{
  "schema": "cgqa.payment-provider-adapter.v0.3",
  "providerId": "stripe-payment-intents-public",
  "profileVersion": "0.1",
  "create": {
    "supportsIdempotencyKey": true,
    "sameKeyReplayDocumented": true
  },
  "stateMap": {
    "requires_confirmation": "pending",
    "requires_action": "pending",
    "processing": "pending",
    "requires_capture": "pending",
    "succeeded": "committed",
    "canceled": "failed"
  },
  "evidenceSources": [
    {
      "kind": "get-payment-intent",
      "authoritativeForFinality": true
    },
    {
      "kind": "payment-intent-webhook",
      "authoritativeForFinality": false
    }
  ],
  "evidencePrecedenceStatus": "unresolved",
  "evidencePrecedence": [],
  "retrySemanticsStatus": "unresolved",
  "retryAllowedAfterProviderStates": [],
  "publicContractRefs": [
    "https://docs.stripe.com/api/idempotent_requests",
    "https://docs.stripe.com/api/payment_intents",
    "https://docs.stripe.com/payments/payment-intents",
    "https://docs.stripe.com/payments/paymentintents/lifecycle",
    "https://docs.stripe.com/api/payment_intents/retrieve",
    "https://docs.stripe.com/webhooks"
  ],
  "openQuestions": [
    "After a create or confirm timeout, which exact Stripe object state should an autonomous caller require before a fresh logical payment is permitted?",
    "When a PaymentIntent is canceled, what separate business or authority evidence should authorize creating a new PaymentIntent for the same higher-level intent?",
    "How should an agent distinguish provider-supported retry of the same PaymentIntent from authorization to create a new logical payment operation?",
    "What application-level lineage should bind the idempotency key, PaymentIntent ID, webhook Event IDs and higher-level order or agent intent?"
  ]
}
